{
  "schema_version": "redevplugin.platform_package_set.v2",
  "platform_version": "1.0.0",
  "go_module": {
    "module": "github.com/floegence/redevplugin",
    "version": "v1.0.0"
  },
  "npm_packages": [
    {
      "name": "@floegence/redevplugin-contracts",
      "version": "1.0.0"
    },
    {
      "name": "@floegence/redevplugin-ui",
      "version": "1.0.0"
    }
  ],
  "rust_crates": [
    {
      "name": "redevplugin-contracts",
      "version": "1.0.0",
      "role": "contracts"
    },
    {
      "name": "redevplugin-ipc",
      "version": "1.0.0",
      "role": "ipc"
    },
    {
      "name": "redevplugin-wasm-abi",
      "version": "1.0.0",
      "role": "wasm_abi"
    },
    {
      "name": "redevplugin-worker-sdk",
      "version": "1.0.0",
      "role": "worker_sdk"
    },
    {
      "name": "redevplugin-runtime",
      "version": "1.0.0",
      "role": "runtime"
    }
  ],
  "contract_registry_version": "contract-registry-v2",
  "contract_set_sha256": "d504fb67e972c1d3dce7d5cbfe24cf198ed4a487a803ca8ea078cfe2925dbbe8"
}
